hospitalName,department,name,specialty,,
서울대학교병원,정신건강의학과,안용민,"조울증, 일반 정신의학과, 우울증",,
서울대학교병원,정신건강의학과,이동영,"인지장애, 노인정신장애, 알츠하이머병, 치매",,
서울대학교병원,정신건강의학과,함봉진,"정신신체의학, 정신종양학: 우울, 불안, 불면, 섬망, 인지장애, 신체화",,
서울대학교병원,정신건강의학과,이유진,"불면, 수면무호흡증, 수면장애, 기면증, 졸림증, 수면장애 (하지불안증후군, 렘수면행동장애, 수면무호흡증)",,
서울대학교병원,정형외과,조태준,"선천성 기형, 골형성부전증, 저신장증, 희귀 골질환, 유전성 골질환",,
서울대학교병원,정형외과,장봉순,"디스크, 척추질환, 협착증, 전방전위증, 황색인대 골화증, 척추 변형/기형, 측만증, 후만증, 척추/척수 종양, 척추골절",,
서울대학교병원,정형외과,김한수,"골육종, 연골육종, 연부조직육종, 골반뼈 종양, 양성 골종양, 전이성 뼈암",,
서울대학교병원,정형외과,이영호,"미세수술, 외상 및 골절, 신경손상 및 마비, 사지재건, 사지접합, 상완신경총 손상 및 마비",,
서울대학교병원,정형외과,유정준,"골반/고관절골절, 고관절, 대퇴부, 엉덩이, 골다공증, 무혈성괴사",,
서울대학교병원,중증외상센터,박도중,,,
서울대학교병원,중증외상센터,박찬용,"외상, 외상학",,
서울대학교병원,중증외상센터,우정우,,,
서울대학교병원,중환자의학과,이상민,"중환자의학, 호흡기중환자, 급성 호흡곤란 증후군, 패혈증",,
서울대학교병원,중환자의학과,류호걸,"패혈증 및 패혈성 쇼크, 고위험 수술 후 중환자 관리, 중환자 섬망 및 진정",,
서울대학교병원,중환자의학과,정윤선,,,
서울대학교병원,중환자의학과,김태정,"뇌졸중(뇌경색,뇌출혈), 신경중환자",,
서울대학교병원,중환자의학과,오승영,"외과중환자관리, 패혈성쇼크, 출혈성쇼크, 간이식 후 관리",,
서울대학교병원,진단검사의학과,김현경,진단혈액학,,
서울대학교병원,진단검사의학과,장윤환,진단혈액학,,
서울대학교병원,진단검사의학과,송은영,진단혈액학,,
서울대학교병원,진단검사의학과,성문우,"분자진단, 분자유전",,
서울대학교병원,진단검사의학과,송상훈,"질체학, 질량분석기 기반 검사",,
서울대학교병원,통증센터,문지연,"만성통증, 신경병증성 통증, 복합부위통증증후군, 대상포진 후 신경통, 삼차신경통, 후두부신경통, 척추(척추디스크, 추간판탈출증, 요통), 척추시술, 경추부통증, 요하지통증, 좌골신경통, 암성통증, 퇴행성 관절염, 근골격계통증",,
서울대학교병원,통증센터,유용재,"만성통증, 통증 치료, 요하지통증, 경추부통증, 근골격계통증, 대상포진후신경통, 삼차신경통, 복합부위 통증 증후군, 암성통증, 신경병증성 통증",,
서울대학교병원,통증센터,김정수,"요하지통증, 통증 치료, 대상포진, 대상포진후신경통, 삼차신경통, 경추부통증, 관절통증, 근골격계통증, 근막통증증후군, 만성통증, 무릎통증, 복합부위 통증 증후군, 신경병증성 통증, 암성통증, 어깨통증",,
서울대학교병원,통증센터,노형상,"대상포진후신경통, 삼차 신경병증, 삼차신경통, 요하지통증, 경추부통증, 만성통증, 근막통증증후군, 만성통증 (두통 및 근막통증증후군 등), 복합부위 통증 증후군, 신경병증성 통증, 암성통증, 통증 치료",,
서울대학교병원,통증센터,김한가람,"경추부통증, 신경병증성 통증, 암성통증, 만성통증, 만성통증 (두통 및 근막통증증후군 등)",,
서울대학교병원,피부과,서대헌,"여드름, 지루성 피부염, 주사, 피지선 관련 질환, 레이저",,
서울대학교병원,피부과,권오상,"원형 탈모증, 남성형탈모증, 여성형탈모증, 모발 및 두피 질환",,
서울대학교병원,피부과,조성진,"건선, 중증보통건선, 전신농포건선, 손발바닥농포증",,
서울대학교병원,피부과,이동훈,"접촉피부염, 습진, 아토피피부염, 만성 단순태선 및 양진, 가려움증, 피부 알레르기, 두드러기, 노화, 미용레이저",,
서울대학교병원,피부과,문제호,"피부암, 흑색종, 손발톱질환, 흉터, 피부외과",,
서울대학교병원,핵의학과,강건욱,"갑상선암, 신경내분비종양, 전립선암, 핵의학",,
서울대학교병원,핵의학과,천기정,"핵의학(종양핵의학), 방사성동위원소치료, 테라노스틱스(분자영상 동반진단-치료)",,
서울대학교병원,핵의학과,이재성,핵의학 영상처리/정량분석,,
서울대학교병원,핵의학과,팽진철,"핵의학분자영상, 순환기 핵의학분자영상",,
서울대학교병원,핵의학과,윤혜원,분자영상,,
서울대학교병원,혈액종양내과,윤성수,"림프종, 다발성골수종, 임상시험",,
서울대학교병원,혈액종양내과,김인호,"만성골수성백혈병, 골수이형성증후군, 골수섬유화증, 다발 골수종",,
서울대학교병원,혈액종양내과,홍준식,"정맥혈전증, 출혈성 질환, 골수형성이상증후군, 급만성 백혈병, 조혈모세포이식, 혈구 수 이상 (증가/감소)",,
서울대학교병원,혈액종양내과,고영일,"림프구성백혈병, 혈액암, 림프종, 다발성골수종, 아밀로이드증, 혈소판감소증, 정밀의료, 임상시험, 맞춤치료",,
서울대학교병원,혈액종양내과,신동엽,"혈구 수 이상 (증가/감소), 빈혈, 혈소판감소증, 혈액응고장애, 백혈병",,
서울대학교병원,호흡기내과,임재준,"비결핵항산균증, 폐결핵",,
서울대학교병원,호흡기내과,이상민,"중환자관리, 폐이식",,
서울대학교병원,호흡기내과,박영식,"폐질환, 폐암, 폐암의심, 흉막 질환, 흉수",,
서울대학교병원,호흡기내과,이진우,"폐결절, 흉막 질환, 수면관련호흡장애, 중환자의학",,
서울대학교병원,호흡기내과,이창훈,"만성폐쇄성폐질환, 천식",,
